{
  "$schema": "https://json-schema.org/draft/2020-12/schema",
  "$id": "https://example.invalid/gpm/runtime-pack.schema.json",
  "title": "M25B Game Runtime Pack Manifest",
  "type": "object",
  "additionalProperties": false,
  "required": ["schema_version", "pack_type", "pack_id", "compatibility_revision", "generator", "canonical_input_kind", "deterministic", "counts", "entrypoints", "debug_symbols_included", "size_metrics", "files"],
  "properties": {
    "schema_version": {"enum": ["1.0.0", "2.0.0"]},
    "pack_type": {"const": "gpm-game-runtime"},
    "pack_id": {"type": "string", "minLength": 1},
    "compatibility_revision": {"type": "string", "minLength": 1},
    "generator": {
      "type": "object",
      "required": ["name", "version", "milestone"],
      "properties": {"name": {"const": "gpm"}, "version": {"type": "string"}, "milestone": {"const": "M25B"}},
      "additionalProperties": false
    },
    "canonical_input_kind": {"enum": ["canonical-status", "m25a-casebook"]},
    "deterministic": {"const": true},
    "counts": {
      "type": "object",
      "required": ["components", "provinces", "political_units", "scenarios", "triangles_by_lod", "tiles", "graph_edges"],
      "properties": {
        "components": {"type": "integer", "minimum": 1},
        "provinces": {"type": "integer", "minimum": 1},
        "political_units": {"type": "integer", "minimum": 0},
        "scenarios": {"type": "integer", "minimum": 1},
        "triangles_by_lod": {"type": "object"},
        "tiles": {"type": "integer", "minimum": 1},
        "graph_edges": {"type": "object"},
        "facet_dimensions": {"type": "integer", "minimum": 0},
        "facet_values": {"type": "integer", "minimum": 0}
      },
      "additionalProperties": false
    },
    "entrypoints": {
      "type": "object",
      "required": ["stable_ids", "scenario_index", "migration", "lowest_lod", "pmtiles"],
      "additionalProperties": {"type": "string", "minLength": 1}
    },
    "debug_symbols_included": {"type": "boolean"},
    "size_metrics": {
      "type": "object",
      "required": ["core_uncompressed_bytes", "core_individually_gzip_bytes", "initial_core_plus_lod0_gzip_bytes", "geometry_archive_bytes"],
      "additionalProperties": {"type": "integer", "minimum": 0}
    },
    "files": {
      "type": "array",
      "minItems": 1,
      "items": {
        "type": "object",
        "additionalProperties": false,
        "required": ["path", "bytes", "sha256"],
        "properties": {
          "path": {"type": "string", "minLength": 1},
          "bytes": {"type": "integer", "minimum": 0},
          "sha256": {"type": "string", "pattern": "^[0-9a-f]{64}$"}
        }
      }
    }
  },
  "allOf": [{
    "if": {"properties": {"schema_version": {"const": "2.0.0"}}, "required": ["schema_version"]},
    "then": {"properties": {"counts": {"required": ["facet_dimensions", "facet_values"]}}}
  }]
}
