{"canonical_input_kind":"m25a-casebook","compatibility_revision":"1","counts":{"components":11,"graph_edges":{"land":1,"port":0,"sea":0,"strait":0},"political_units":19,"provinces":10,"scenarios":8,"tiles":3,"triangles_by_lod":{"0":20,"1":22,"2":22}},"debug_symbols_included":false,"deterministic":true,"entrypoints":{"lowest_lod":"geometry/lod0.tri","migration":"migration.json","pmtiles":"geometry/map.pmtiles","scenario_index":"scenarios/index.json","stable_ids":"core/stable_ids.json"},"files":[{"bytes":148,"path":"core/components.bin","sha256":"e8ddce117ea9b7362f7547e7c35b1455f2762415fe4d4ccbc8503603beaba4be"},{"bytes":92,"path":"core/political_units.bin","sha256":"941d2c64c2bdeee199e79c7e55dd88e3984dde1c7f1ac25153c9e7a11f2b94e7"},{"bytes":60,"path":"core/province_components.bin","sha256":"b11426e34564c2de2962928a6bb688fa327472f41bacf84a73260046130b6829"},{"bytes":216,"path":"core/provinces.bin","sha256":"1daa4adcd3da7aa010fa538ffbfba454bac61f36c27f348eaa1aaf98c9b044c0"},{"bytes":1291,"path":"core/stable_ids.json","sha256":"c89d108330e075ba474537f1a72e485540c908e9dd29ee9c51a0b308b3eedfa1"},{"bytes":652,"path":"geometry/lod0.tri","sha256":"d65c860babf2adc9e1a453b1930f55a209304a51d913728d8e7576b66d69630f"},{"bytes":716,"path":"geometry/lod1.tri","sha256":"f5cfcdf91b66a429c4ef44caf0d3ec590b842a870c9df4fd5fe2014304d9dc0f"},{"bytes":716,"path":"geometry/lod2.tri","sha256":"f5cfcdf91b66a429c4ef44caf0d3ec590b842a870c9df4fd5fe2014304d9dc0f"},{"bytes":1112,"path":"geometry/map.pmtiles","sha256":"e7f838c8731c2033e257beb0118687460dcf974ba5f3add75f9dd312d62b10b1"},{"bytes":68,"path":"graphs/land.csr","sha256":"74a0f79fc922c2f5a364e004fed79ec794529bd2e1563a62f857f7d0525e5ea7"},{"bytes":60,"path":"graphs/port.csr","sha256":"e9f4d4382fa3dcdbc6521d06a8a95ec4954e19b50570101f2af39387cfaa6942"},{"bytes":60,"path":"graphs/sea.csr","sha256":"e9f4d4382fa3dcdbc6521d06a8a95ec4954e19b50570101f2af39387cfaa6942"},{"bytes":60,"path":"graphs/strait.csr","sha256":"e9f4d4382fa3dcdbc6521d06a8a95ec4954e19b50570101f2af39387cfaa6942"},{"bytes":465,"path":"migration.json","sha256":"3a707da54d6024dc29fa80a0906b3c6c624da7f0ac63f218f95981cae9a12d56"},{"bytes":40,"path":"scenarios/base.bin","sha256":"90a3c23e6778ee048759e3fb83c913f2691ac30e470eb20ab2e7a4181ee54051"},{"bytes":68,"path":"scenarios/delta-001.bin","sha256":"601f4fb1d8ec1738fe76193b1148af9e0aeda25001bdc276e506c463999ae87b"},{"bytes":80,"path":"scenarios/delta-002.bin","sha256":"99b1c7a262fa324aa240b8c3b2d72390c0c15a19319167daea8d39cec02b30bc"},{"bytes":80,"path":"scenarios/delta-003.bin","sha256":"0eb6422d2f3c615c482a6ebacb6f382fc360f648b82b3c707068eb19efbdaa54"},{"bytes":80,"path":"scenarios/delta-004.bin","sha256":"0b745dc09fb1841dc9ae0364965418a6652eab8b5d4cf46d5b96e456317493ca"},{"bytes":92,"path":"scenarios/delta-005.bin","sha256":"8a498b2cc11dbe82ffd99d7965965a057ba4948b77c2e8d2b0d2ae053aaa3b43"},{"bytes":80,"path":"scenarios/delta-006.bin","sha256":"599abec2fe235edcbdc18bd4eae92cfdcb49ddb08784ce3086e5f0a7a37e1158"},{"bytes":92,"path":"scenarios/delta-007.bin","sha256":"013d2686e37916ebaa5bcceeed8db69bdab87d0e59112662520864357003742e"},{"bytes":1498,"path":"scenarios/index.json","sha256":"0cab041f95e35f6318cbb2847ae745407712b70e88443a6fc9913bcb077d4a6e"},{"bytes":36,"path":"scenarios/unions-000.bin","sha256":"44e29e277392e15986f37fd48905eda60324f47df2663b202feee44bf0553f32"},{"bytes":16,"path":"scenarios/unions-001.bin","sha256":"973a02dc6197cfc99733a7d963bd77028d34441e7ca420affcd5357bbbaefcc0"},{"bytes":16,"path":"scenarios/unions-002.bin","sha256":"973a02dc6197cfc99733a7d963bd77028d34441e7ca420affcd5357bbbaefcc0"},{"bytes":16,"path":"scenarios/unions-003.bin","sha256":"973a02dc6197cfc99733a7d963bd77028d34441e7ca420affcd5357bbbaefcc0"},{"bytes":16,"path":"scenarios/unions-004.bin","sha256":"973a02dc6197cfc99733a7d963bd77028d34441e7ca420affcd5357bbbaefcc0"},{"bytes":16,"path":"scenarios/unions-005.bin","sha256":"973a02dc6197cfc99733a7d963bd77028d34441e7ca420affcd5357bbbaefcc0"},{"bytes":16,"path":"scenarios/unions-006.bin","sha256":"973a02dc6197cfc99733a7d963bd77028d34441e7ca420affcd5357bbbaefcc0"},{"bytes":16,"path":"scenarios/unions-007.bin","sha256":"973a02dc6197cfc99733a7d963bd77028d34441e7ca420affcd5357bbbaefcc0"}],"generator":{"milestone":"M25B","name":"gpm","version":"0.1.0"},"pack_id":"m25b-hard-cases-v1","pack_type":"gpm-game-runtime","schema_version":"1.0.0","size_metrics":{"core_individually_gzip_bytes":2051,"core_uncompressed_bytes":4313,"geometry_archive_bytes":3196,"initial_core_plus_lod0_gzip_bytes":2237}}
